high_conscientiousness,enterprising,HCE,The Entrepreneur,"For you, God's not only in the details, but in the big idea as well.  That's a pretty powerful combination, whether we're talking about your job or your social life and relationships.  Not only are you able to see the big picture and inspire others to believe in it, you also have the capacity to purposefully plan and carry out a strategy for making it a reality. ","The energy and enthusiasm you bring to life is one reason people want to be around you and will follow you.  Another is the respect you earn when you roll up your sleeves and methodically go to work on getting things done--the right way.  One of the best things you can do to achieve success -- in a career, or in a relationship -- is to live your life as someone others know they can count on.","Be patient with the people around you who approach tasks differently, and remain open to new ways to tackle issues as they arise.  Compromise and flexibility are strengths for you to further develop, since sometimes a less meticulous strategy can result in new and surprising solutions to a problem.","**The Entrepreneur** brings energy, enthusiasm, and a focused attention to detail through a big-picture perspective.",You have a *big-picture perspective*.,"You can break down and plan out assignments in order to achieve fantastic results, and you care about *doing things the right way*.",*Work on becoming even more flexible* in the way you look at situations in your life; don't get stuck thinking there's only one way to approach an issue.high_conscientiousness,conventional,HCC,The Detailer,"As far as you're concerned, ""Throw caution to the wind"" is a phrase used by irresponsible adrenaline addicts who accomplish little and suffer all kinds of undesirable, long-term consequences.  Your approach to life and work is measured and sensible.  You love structure and order, and you see rules and routines as your friends.  By doing things the right way, crossing every ""t"" and dotting every ""i,"" you can feel comfortable knowing that your planning and persistence will pay off. ","Because of your high level of conscientiousness, you're most likely known as someone others can count on.  At work and in your social life and relationships, people view you as solid and dependable.","One temptation for you to resist is to immediately dismiss any new idea or approach offered by someone who arrives at solutions differently from you.  Your commitment to doing things right is admirable.  Just don't let your desire to follow directions or observe a set routine cause you to miss out on learning something new, or seeing a novel way to approach a situation that pops up.  In other words, stay true to who you are, continuing to take pride in whatever you do, but also work hard to remain open-minded in all facets of your life--your job, your social life, and your relationships.","**The Detailer** uses persistence, planning, and an attention to rules and routines, to achieve high-quality results.","You always *analyze and plan* before leaping into action, relying on trusted routines and traditional strategies to achieve ideal results.","As a result, *people know they can count on you*.","Sometimes you should *consider new approaches to situations*, rather than sticking to your favorite routines out of habit."low_conscientiousness,realistic,LCR,The Charger,"One thing the people who know you probably love about you is that you're ready to take charge and take care of whatever needs to be accomplished.  Like Larry the Cable Guy, your response when a new task presents itself is, ""Let's get 'er done.""  There's a lot to appreciate in someone who brings this kind of enthusiastic response to whatever situation presents itself.","One potential problem, though, is that your eagerness to get things done sometimes gets the best of you.  You have a tendency to act before you've thought through your strategy or fully determined your long-term goal.  ","Again, there are definite advantages to being willing to take charge at any point and time.  But a ""leap before you look"" approach to life can cause  significant problems as well.  Unless you can find a way to be a bit more cautious at times, and to think through the different possible outcomes of your actions,  you're going to severely limit how successful you will be, whether it's at work or in your social life and relationships.","**The Charger** brings leadership, a direct approach, and tenacity through enthusiastic spontaneity.",You know how to *take charge and dive into action*.,People often appreciate your enthusiastic willingness to jump in and contribute when any situation presents itself.,"Caution, though, and *careful planning*, should also be tools you use at times, so that when you throw yourself into action, you have a greater chance of success."low_conscientiousness,investigative,LCI,The Explorer,"Dr. Jeckyll, meet Mr. Hyde.  You seem to have two main parts of yourself.  On one hand, you can be impulsive, making quick decisions when faced with a dilemma or problem.  On the other hand, though, especially when it comes to big life decisions or an important work project, you like to collect information and analyze situations before making decisions.","It's good to be able to come at a problem from different perspectives, but these contradictions may leave you feeling somewhat divided within yourself at times.  ","Now might be a good time to explore this dichotomy a bit.  What makes you feel so comfortable making a snap decision on an issue sometimes, while at other moments you feel the need to fully think something through?  The more you can get clear on your own preferences for how to approach a situation, the more effective you'll be in your workplace, in your relationships, and probably in your life as a whole.","**The Explorer** brings versatility, making decisions both impulsively and after a long planning process.",Sometimes you *gather information and analyze problems* before diving into action.,At other times you're *not that interested in planning* ahead and considering possible consequences.,"It's fine to be impulsive, but *don't get caught being careless* about the important details of your life. "low_conscientiousness,artistic,LCA,The Free Verse Poet,"Spontaneity and creativity guide you in the way you live your life.  Rules?  Not for you.  Structure?  No thanks.  The way you see it, the minute you start caring about what others think, is the minute you stop being yourself.  ",This willingness to free yourself from society's expectations and follow your own imagination can help you create all kinds of new ways to approach  whatever situation comes up. You've probably noticed that sometimes you're the first one to come up with a novel idea or solution that's stumped everyone else.,"The drawback, though, as you've no doubt already seen, is that your impulsiveness can sometimes make you seem less responsible or reliable.  You may have found that your spontaneity can produce negative consequences in terms of how you're perceived by your co-workers, and by the people you're in relationship with.   There's no need to change who you are; your fun-loving, artistic personality is a strength you should capitalize on.  However, the more you can also consider the expectations of those around you, and show yourself to be reliable and consistent, the more your spontaneity will shine as a strength, rather than a potential limitation.",**The Free Verse Poet** invents revolutionary approaches and solutions through an innate sense of creative spontaneity.,You use *creativity and imagination* to implement original solutions to complex problems.,You *value creative freedom and autonomy* in your work and relationships.,Sometimes you should *balance your spontaneity* with a reliability and stability that will enhance your relationships at work and in your social life.low_conscientiousness,social,LCS,The Connector,"OK, so you're not the most responsible person in the world.  You admit it.  But one of the things you're really good at is connecting with others.  In fact, that's kind of the point for you:  People matter more than ideas or things or deadlines.  You care about helping people, and you enjoy the closeness and connection you feel when you're in a group.  You have a spontaneous nature, and that may be part of why you're good at developing relationships.  Those around you may see you as fun because of your impulsive tendencies.","Your commitment to people is admirable, and your empathy and sensitivity to others can help you solve problems that come up, sometimes before other people are even aware of them.  ","But keep in mind that, especially at work or in serious relationships, there will be certain expectations when it comes to your reliability and constancy.  Commitment and trust are requirements in any relationship, and planning and persistence, even if they don't come naturally to you, can take you a long way if you work at them.  So continue to use your social skills and gifts, but don't neglect meeting whatever responsibilities you have to the people you care about.",**The Connector** brings caring sensitivity and enthusiasm through spontaneous sociability.,You *get along well with others* and care about the people around you.,You *value individuals* over abstract ideas like deadlines and other so-called responsibilities.,Add to your notable social gifts a reliability and responsibility that will deepen the trust others have in you.low_conscientiousness,enterprising,LCE,The Trendsetter,"Some people love the details.  You? Not so much.  You're into the big picture.  You're an idea person. You want to organize and lead others, taking them further than they would go by themselves.  Whether it's at your job or in your social life, you bring a high-energy approach to pretty much whatever you do. These visionary tendencies are a real strength for you, especially when you combine them with hard work and careful planning.","But that's the problem for you, at least potentially.  You value spontaneity, perhaps a bit too much.  Instead of gathering information and analyzing a situation when faced with a situation in your career or in a relationship, you're more likely to make a quick, bold decision.  The willingness to take a risk can bring with it a big pay-off, but the dangers can be great as well.  ","So remain aware of your strengths, as well as where you can use some help.  After all, we all need each other, and no one creates anything great by themselves.  Find people in your life who can balance your big-idea perspective with down-to-earth planning and stability, who can give some foundation to your visions and dreams.  ","**The Trendsetter** provides vision, leadership, and spontaneity along with a big-picture perspective.",You excel at *leadership and spontaneous action*.,"*Hard work and careful planning* can help bring your visions to life, but offering a methodical approach isn't exactly your strong suit.",Watch for ways to include people in your life who can offer a stable and consistent foundation for your *lofty dreams and ideals*.low_conscientiousness,conventional,LCC,The Impulse Planner,"It's not that you have a dual personality, but you do seem to live your life guided by two distinct parts of yourself.  At times, you're perfectly willing to act spontaneously, even impulsively.  At moments like these, you have almost no interest in analyzing a situation or gathering information to help you make a decision.  But at other times, like when you're given a task at work, or an issue comes up in a relationship, you can be just the opposite.  Then you become methodical, completing projects and addressing situations by following routines and observing every little detail.","Each of these parts can serve you well.  The spontaneous aspect of your personality can keep life exciting, for you and for the people around you.   Likewise, the deliberate, structured part of yourself can give you a stability that can ground you and keep you from going too far off the rails.","This division within yourself is something that would probably be good to explore a bit.  Ask yourself what makes you sometimes swing back and forth between impulsivity and conscientiousness.  If you can get more clear on this apparent contradiction, you'll have a better sense of who you are, and how you can be more effective and productive, in both your professional and personal lives.","**The Impulse Planner** is often methodical and deliberate, but can also shift into an approach to life and relationships guided by spontaneity and impulsivity. ","You are comfortable making *spontaneous decisions*, but you often prefer to *dissect and analyze* projects before diving into action.",These dual aspects of your personality can serve you well if you can *balance them* and not let either one overpower the other.,"Spend some time observing and thinking about these two ways you approach life, watching for ways you can achieve an even healthier balance between the two."high_neuroticism,realistic,HNR,The Power Tool,"A new task?  A new challenge?  Bring it on, you say.  Especially if it requires that you work with your hands and get to use tools. You like to jump in and get things done.  One of the last things you want to do is sit around discussing issues and ""alternative perspectives"" all the time.  You're more in line with what Walt Whitman wrote:  ""How beggarly appear arguments before a defiant deed!""  ","One challenge you face fairly regularly, though, is learning to control your emotions.  At times, this may affect your ability to maintain good relationships with the people in your life.  It's not that you don't like being with people.  You know that relationships are an important part of life, and that they give meaning to much of what we do as human beings.  Plus, the fact that you often react emotionally and intensely when things don't go your way, means that you're full of passion.  That's a good thing, and most likely there are people in your life who appreciate your ability to feel your feelings.  ","The bad news, though, is that an inability to maintain control over your feelings and reactions can cause you all kinds of problems, in both your professional and personal life.  So now's probably a good time for you to look at your tendency to get upset more easily than others.  Simply by acknowledging that this is a problem you want to address, you'll be taking an important step towards growth and increased happiness.","**The Power Tool** enjoys tackling practical, hands-on tasks, and does so with spirited emotion that at times can appear almost overpowering to the people around them.                                                                                                                                                                                                                                                                          ","You prefer concrete projects over abstract assignments, and you want to *jump into any new challenge*.",You react more strongly than most people when things don't go your way.,We encourage you to spend some time thinking about your *high-emotion reactions* that can hold you back in both your career and in your relationships.high_neuroticism,investigative,HNI,The Scrutinizer,"Robert Frost once said ""Don't ever take a fence down until you know why it was put up.""  You totally get what he was talking about.  There are people in this world who blindly jump into any problem, ready to immediately take it on before they even understand the problem.  You?  No way.  Your approach is to carefully and methodically observe a situation, analyze any relevant information, then make an informed decision about how best to proceed.  This steady approach has proven successful for you over time, and the people in your life know they can count on you to fully think through any issue that arises and, often, come up with an interesting and original approach to it.  ","One concern to remain aware of, though, is your tendency to react pretty intensely when things don't go your way.  When new obstacles present themselves before you, you're not always able to maintain control over your emotions.  This is something you want to pay attention to.  As problems arise at work or in your social life, remain aware of how you're experiencing your emotions in your mind and your body, and take steps to maintain control.  One of the best things you can do is just slow your breathing and relax your shoulders.  Do whatever you need in order to stay in control of yourself.","Then, once you've calmed yourself, be proactive in the way you address that particular problem.  Visit with the people involved about whatever upsets you, and discuss with them how best to address the issue, improving the relational environment for everyone. ","**The Scrutinizer** carefully surveys a situation before diving in with intense focus and, sometimes, intense emotion. ",You rely on *careful planning and analysis* to make decisions about how you live your life.,"Sometimes, though, your *emotional reactions keep you from maintaining control* of yourself.","By taking a minute to *cool off* when your emotions begin to run amuck, you can move towards making the various aspects of your life -- your job, your social life, your relationships -- more happy and successful."high_neuroticism,artistic,HNA,The Microwave,"Wow, you've got it all.  Serious artistic sensibilities, with the temperament to go with it.  You bring originality and creativity to your work, and you have little interest in following conventions and expectations.  In your emotional life, you also tend to move away from the middle.  Especially when things don't go your way, you can react pretty intensely.  ","Chances are, there are plenty of people around you who love the gusto with which you work and live your life.  It may be, too, though, that your strong negative reactions when things go wrong are keeping you from being as successful as you could be, in both your career and your relationships.  Do your best to notice when you feel yourself becoming upset, and try to manage those feelings before allowing them to explode into larger actions and reactions.","Also, once you notice something that's consistently upsetting you, take steps to address the situation.  Be proactive, talking to the person you have an issue with so it's not a constant source of irritation.  Then you can enjoy the relationship again and get back to doing what you do so well:  using your creativity and imagination to come up with interesting and novel ideas.",**The Microwave** heats up quickly emotionally then cooks with creative passion and intense originality.,"You have an excellent *sense of creativity*, preferring to invent original solutions rather than follow set routines.","But your life, and especially your relationships, are in danger of being harmed by your tendency to *react so strongly when problems come up*.","Work on taking proactive steps to deal with workplace and relational conflicts, rather than letting resentment fester and hurt everyone involved."high_neuroticism,social,HNS,The Shelter,"You seem to have a way with people, and your ability to let others know you care about them is a real strength when it comes to how you do relate to the people around you.  One thing that gets in your way sometimes, though, is your tendency to react pretty intensely when things don't go your way.  There's nothing wrong with getting upset -- everyone does -- but sometimes negative situations affect you more strongly than they do other people.","It's good that you're so in touch with your emotional side.  But when those strong emotions get in the way of accomplishing what you want to accomplish -- in your job, in your social life, in your relationships -- you might want to take steps to deal with those feelings more productively.  This is especially the case since you care so much about helping others and responding to how they feel.","So the next time you find yourself getting upset with a situation or a person in your life, pay attention to the sensations in your body.  Take a deep breath and relax your shoulders.  If you feel you won't be able to maintain control, then excuse yourself for a few minutes until you feel more calm.  Then you can return and deal with the situation in a way that will feel better to everyone involved.","**The Shelter** builds strong connections and is good at caring for others, often approaching situations with intense emotions. ",You care very much for the people around you and *want to help others* as much as possible.,"Sometimes, though, you have a *difficult time controlling your emotions* when things don't go your way.","*Pay attention to your body* when you begin to become upset, and use that awareness as a red flag that warns you to take proactive steps towards calming down."high_neuroticism,enterprising,HNE,The Producer,"Some people prefer to play things safe, making sure to quietly color inside the lines when there's a job to do.  You?  Not so much.  You're more about seeing a problem and solving it, even if you need to take some risks.  And your assertiveness, combined with your communication skills, means that people will often follow you when you take charge.","It also seems to be true, though, that minor frustrations can upset you more than they upset most people.  This can create obstacles in your attempt to accomplish what you envision -- whether we're talking about your professional or personal life -- and it can sometimes limit your ability to interact with others in a meaningful way.  Your passion is a strength, and it's good that you feel deeply.  But your intense reactions aren't always your friend when it comes to how they affect your work and relationships. ","We want to encourage you to remain aware of this tendency, so you can maintain control of yourself and your emotions when irritations arise.  Do your best to be proactive, staying ahead of your frustration, so that when upsetting problems do arise, you can monitor your response and even excuse yourself from a room if necessary.  Then you'll have a much better chance of comporting yourself in a way that will earn the loyalty and respect of the people you care about.","**The Producer** embodies bold, out-of-the-box leadership fueled by passionate emotion.",You have the *assertiveness and communication skills* that can make *people want to follow you*.,"Your emotions, though, can get the best of you sometimes when difficulties arise.",*Work on remaining aware of your emotions* so you don't do damage to your career or relationships in a moment of weakness.high_neuroticism,conventional,HNC,The Analyst,"You love organization, and you're good at it.  Give you a set of information, and you'll analyze it, categorize it, and deliver it in a way that's clear and concise.  This attention to detail and routine allows you to maintain neatness and order in your life and work.  What's difficult, though, is that at times, your emotions don't always follow suit.  You can identify with Jim Morrison, who once said, ""I think of myself as an intelligent, sensitive human being with the soul of a clown which always forces me to blow it at the most important moments.""","As much as you love order and control, you also ""blow it"" sometimes when frustrations arise and you have a hard time staying on top of your feelings.  It seems that, more than most people, you tend to react pretty intensely when things don't go your way.  Most likely, that's especially hard for you to deal with, since your preference in general -- at your job and in your relationships -- is to maintain control.","Now might be a good time to use your analytical and organizational powers to get ahead of this control issue.  Spend some time exploring what factors generally set you off or cause you trouble.  Then explore possible responses.  Think of it as an assignment, where your task is to better understand your tendency to react strongly to the irritations that crop up around you.  You don't have to solve the whole puzzle; but the more you can get on top of this issue, the better you'll be at creating the order and neatness you crave and enjoy in your life and work.","**The Analyst** combines an exquisite attention to rules, routines, and details, with occasional displays of passion and high emotions.","You excel at *organization and detailed analysis*, and your focus on small details is a gift that serves you well.","But *your emotions sometimes get the best of you*, and this can hamper your ability to succeed in your career and relationships.",Use your analytical skills to examine this issue and to *explore how best to gain control* of yourself and your emotions.